image_filename,reference,image_entropy_total,image_entropy_r,image_entropy_g,image_entropy_b,text_entropy
108503753.jpg,The regional park police helicopter is preparing to land. A white and green helicopter takes off from the airfield. A helicopter on a clear day taking off. A helicopter is taking off for flight. Helicopter taking off from airport.,6.762466294492398,6.846324364672415,6.822647719051957,6.618426799752823,3.8042146762895213
10863862.jpg,"An older, male construction worker wearing a yellow vest climbing down from the roof of a building onto scaffolding. A man in a yellow vest is standing on the wall above the scaffold. A man in a reflective jacket positions himself on scaffolding. A construction worker is on climbing on top of a building. A man climbs down a scaffolding.",7.699546719969429,7.800661367270335,7.690856655949757,7.607122136688194,3.8976935140131417
108656820.jpg,"A group of people are either standing or sitting, some are wearing hats and scarves, while some are not. A group of fourteen is assembled in a hall with dining tables and a stage. A large group of people mingling in a room with a tile floor. Lots of people in different costumes at some kind of party. A gathering of people standing by a stage.",7.5741787738658255,7.64047458944768,7.536211608341704,7.545850123808094,3.82736127031366
1087168168.jpg,A young boy jumping and a young girl sitting in an inflatable pool. A boy is jumping on an inflatable ring and a girl is watching him Two young kids are playing in the water on an inflated toy. A teenage boy is jumping on an inflatable slide. A boy jumping on a water jumphouse,7.61815586746716,7.616308228794626,7.699793812719368,7.538365560887487,3.8806893709572403
1087539207.jpg,Several children playing on a Polaris vehicle outdoors. The children played on the four wheeler in the field. A family playing on a tractor on a beautiful day The four kids are riding on an ATV in a field. Children ride a tractor in a field.,7.696769692245762,7.779938125734878,7.74368818280438,7.566682768198028,3.754412248071389
1088385559.jpg,"An older woman stir fries vegetables in a home kitchen, with a counter crowded with jars and bottles in the background. An Indian woman in traditional clothing cooks vegetables on her stove. An elderly woman is cooking dinner in a frying pan. An elderly woman pan frying food in a kitchen. A white-haired woman in cooking vegetables.",7.707010195414036,7.7776174267492095,7.710638545050353,7.632774614442547,3.938247743383029
1088767354.jpg,The girl in the salmon colored bikini is standing next to two young people; one is wearing a black outfit and the other is drinking pop. Two young people are approached by a flamboyant young woman dressed in a red bikini and a red feathered headress. A woman wearing a red costume looks at two other people standing on a street. A young woman in a red sequined costume and feather stands on the sidewalk. A woman in a red costume to the left of a man and woman standing together.,7.569679968136389,7.669014230011267,7.485959247754278,7.554066426643621,3.90575612695151
108898978.jpg,Two people wearing yellow jackets crosscountry skiing. Two skiers are making their way through woodland. Two skiers are sliding down a trail in the woods. Two men are skiing in the snow in a wooded area. Skiiers walking up the hill through a forest.,6.801690949988551,6.962894553088245,6.81424871009524,6.627929586782168,3.8270223151743226
108899015.jpg,A lone skier is making their way up a mountain. Skiiers at the top of a snow covered hill. Two people are on a snow-covered mountain. Two people climbing up a snowy mountain. Two hikers climbing a snowy hill.,7.180172679558038,7.1922705262914555,7.308981009655329,7.039266502727331,3.853643576345756
1089059626.jpg,An Asian man in spectacles and a t-shirt preparing some food. A man working diligently while sitting at a table. Man sitting using tool at a table in his home. Indian man whittles in his own home. A man is sharpening a knife.,7.447153750644353,7.689129839587193,7.562096965498441,7.0902344468474245,3.607680653262848
1089181217.jpg,A light brown dog runs down a path happily. A brown dog running down a paved pathway A brown dog running next to grass. A dog is running down a road. Energetic brown dog running,7.367533289052172,7.535576417302646,7.268128701237469,7.298894748616402,3.5923034701487673
1089354362.jpg,"A girl sitting on the steps of a building wearing a green short-sleeve shirt, blue jeans, flip-flops holding a cup and writing in a journal with her purse sitting at her feet. A woman in a green shirt and jeans kneels on a stoop with coffee in hand, her purse beside her and a large door behind her, as she fills out paperwork. A woman is sitting on the steps in front of a large black door, writing in a notebook. A woman sitting down on steps, writing something down with a door behind her. A girl holding a coffee cup is writing outside.",7.583911127392201,7.593570693148679,7.56895045344254,7.589212235585384,3.9203743087661977
108957912.jpg,People walk across a street as utility workers fix a light. Many people are crossing a street in a large city. People are crossing a city street intersection. Pedestrians cross the street at a red light. People crossing a city street.,7.399742943886285,7.420247185523527,7.384963627983277,7.394018018152053,3.6662561331204406
108970557.jpg,Woman sitting in a red chair with a dressy purple dress on and a book sitting on the arm rest. A woman dressed in light purple and wearing a corsage clasps her hands in her lap. A woman in lavender with short brown hair is sitting in a large chair. The women is wearing formal clothing while sitting. A short-haired woman is sitting down.,6.873023839274843,7.572211150220623,6.404490881252142,6.642369486351765,3.8081114108178666
1089755335.jpg,A woman stands with children on a boardwalk at night overlooking the sea. Woman with three children fishing over boardwalk in the evening. A woman and three children stand on a deck with a fishing pole. Some people on a pier at night with one girl fishing off it. A mother and children is fishing on a boardwalk at night.,7.1666142391774175,7.376590583364749,7.0059549712778635,7.117297162889642,3.8747721011644516
109083036.jpg,Six males playing a game in the sand with wooden paddles. Group of young men playing cricket in a dirt field. Six west Asian youth play cricket on a dirt pitch. A crowd of boys play cricket in an open sand lot. Children playing cricket in a dry desert area,7.628351243071734,7.742642782530437,7.621315707586076,7.5210952390986865,3.851341439018415
1091942526.jpg,"A woman is laughing as two small boys play around her and a small girl climbs up her back. A girl laughs while holding an younger girl on her back and facing a small child. A woman in a green tank top is surrounded by three children, laughing. A young woman playing with children at a backyard party in the summer. A woman playing with kids.",7.210178766986995,7.245492958505234,7.206446325800267,7.178597016655481,3.947887180794831
10919429.jpg,"A man in a black shirt and black jeans and a little boy are taking a look inside a green truck's engine while it is parked in a grass field with a gas tank in front of it. A male in a black shirt, and black pants, working on the engine of an old, green antique automobile, with a yellow gas canister sitting on the grass. A young man and a toddler look under the hood of an old-fashioned truck. A man and children work on the engine of an old truck. Man working on old truck while child watches.",7.0580789609916605,7.537489162679664,7.381230739441015,6.255516980854302,3.9172753583524837
109202756.jpg,A woman dressed in a blue jacket and blue jeans rides a brown horse near a frozen lake and snow-covered mountain. A young blond woman sitting atop a brown draft horse in the snowy mountains. A woman rides a horse near a frozen lake in the winter time. Woman n blue jacket sits on daft horse near a frozen lake. A woman in a blue jacket rides a brown pony near water.,7.626584299777619,7.649430839605817,7.654236010720139,7.5760860490069,3.8546187761965927
109202801.jpg,Two golden brown horses pull a sleigh driven by a woman in a blue coat. Two horses pull a carriage driven by a woman over snow covered ground. Two horses pulling a sled steered by a smiling blond woman. Two draft horses pull a cart through the snow. Two horses are pulling a woman in a cart.,7.094510379252551,7.27590249046251,7.1036954990440675,6.903933148251074,3.8990863903734465
1092437557.jpg,Woman is enjoying herself being outdoors biking in a forrest preserve. A girl in an orange tank top is walking her bike through the forrest. A smiling woman in a peach tank top stands holding a mountain bike A happy teenage girl taking a break from her bike ride. A girl smiles while holding her bike in a field.,7.527048492971802,7.588453479183276,7.606770366854006,7.385921632878125,3.872178961364088
109260216.jpg,"A person climbs a tall, flat mountain while holding onto a safety rope. A person is climbing a rock while holding onto a white rope. A person climbing down a sheer rock cliff using a rope A person wearing a red vest climbs up a steep rock. A person rappels down a steep incline.",7.385580842168281,7.474395126688137,7.318178299568931,7.364169100247773,3.8787201599416132
109260218.jpg,Spelunkers pose inside a rock cavern while bathed in sunlight from the surface. Shaft of light in a cave shows three spelunkers Three rock climbers are posing on big rocks. People stand inside a rock dome. Three people sit in a cave.,7.188450914563394,7.34720873001997,7.095000118762742,7.123143894907471,3.8283993348610545
1093716555.jpg,A group of hikers are resting on the ground in front of some mountains. Several hikers rest with their gear in front of a mountain. The group of hikers is resting in front of a mountain. People camp with the mountains in the background. A group of backpackers lay on the dry ground.,7.091054746165045,7.31997888805272,6.6835968856988215,7.2695884647435935,3.857967553837921
1093737381.jpg,A woman wearing a blue dress is drawing a picture of a boy and a girl on the sidewalk with sidewalk chalk. A woman in a blue dress stands with a chalk portrait of two children playing by a stream. A woman stands next to a chalk drawing in front of a barn-like structure. A woman stands outside near an elaborate chalk illustration. A woman standing in front of a chalk drawing,7.283939674451891,7.257887410004871,7.266599216062,7.327332397288803,3.9195890853900144
109380144.jpg,"Three young adults are sitting around, with the girl pretending to kick one of the guys in the face while laughing, and the guy behind him looks like he's in midsentence. A man wearing an Illinois t-shirt is looking at a camera while a girl is aiming her foot at his face and another man is making an odd face in the background. A man sitting on the ground is playfully kicked by a young woman, while a man in the back observes. A girl playfully kicks a guy in the face while another person makes faces. A girl sitting down puts her shoe up to a guy's face.",7.6771830184348415,7.745262821159512,7.651614515944369,7.634671718200643,4.0195535596443195
1093807815.jpg,A group of African American children with their arms above their heads and happy expressions on their faces. A group of African-American children have their hands up in the air singing or shouting in a classroom. Many young dark complected children raising their arms in the air in excitement. The children are singing and holding their arms in the air. A group of kids in class with their hands in the air.,7.5096906227400035,7.697549176436274,7.682373093139049,7.14914959864469,3.8747968275576925
1094283901.jpg,A shirtless man jumping off a large concrete structure into a river with his friends watching from the structure. A man wearing swimming trunks jumps off a concrete platform into a large body of water. A shirtless man leaps into the water as other people watch. A man is jumping off complex into a body of water. A man jumping into the water. A brown dog plays in a deep pile of snow. A tan dog stand in the snow and looks up. A dog looking at the camera in snow. The brown dog is out in the snow. A dog runs through the snow.,7.541795669024455,7.575659731958784,7.499355682625704,7.550371592488874,3.74625546634347
1094606832.jpg,A young black person wearing a green shirt and a jacket using a sewing machine. A woman wearing a brown headscarf works at a sewing machine. Woman meticulously working with a sewing machine. A black woman using a sowing machine. Woman with a brown headscarf sewing.,7.4046858208401245,7.674095573099251,7.482980833774499,7.056981055646624,3.86848106499355
1094671386.jpg,"An oriental woman with her fist raised in the air, other oriental people around her, and a black Moped beside her. A lady in a white t-shirt is looking toward the person with their arm raised in the air. A woman wearing a white t-shirt has her right arm extended with her fist closed. Asian girls in white t-shirts standing around a motorcycle. Two young girls in a street.",7.7514971912643675,7.6806084916708155,7.741591497018448,7.832291585103839,3.8218916474859426
1095109931.jpg,A woman smiles while holding several green peppers at a grocery stand. A young woman holds a red and green pepper at a vegetable stand. A girl working at a farm market selling peppers. A woman smiles as she holds some bell peppers. Woman with a tank top buying green peppers.,7.801792039933109,7.82511991991677,7.793649207392508,7.786606992490051,3.778646435557532
10951809.jpg,"An elderly woman with a cane sits in a large wooden chair next to a weaving loom, in a log cabin. The elderly woman is enjoying an afternoon on the porch with family. An elderly women is sitting in a chair with a cane in her hand. An old women with a cane sitting in her rocking chair. An elderly woman with a can is sitting down.",7.596451102430166,7.640001353531606,7.59456400091482,7.55478795284407,3.8011747730413177
109544260.jpg,A little boy in a striped shirt and blue jeans is blowing bubbles from a red container. A young jean-clad boy is sitting on brown grass blowing bubbles out of a red container. One young boy is sitting outside on a cool day blowing bubbles. Young boy sitting down outside and blowing bubbles. A boy has blown four bubbles on the lawn.,7.484411035668951,7.563124265399232,7.467692138727631,7.422416702879988,3.8148984762335174
1095476286.jpg,A young boy is jumping through water being sprayed up from the ground. A little boy playing in the water. A boy plays in the fountains. A child plays in a fountain. A boy jumping in a fountain.,7.770050526366769,7.790362639551629,7.754901502372349,7.764887437176326,3.7023312717505226
1095580424.jpg,The dog is running out of the tunnel on a dog obedience course. The small brown and white dog is running out of a small tunnel. Dog running out of tunnel on obstacle course A dog runs out of a tunnel on a course. A Corgi runs out of a tunnel.,7.884985013587197,7.872684806260687,7.918307285213169,7.863962949287733,3.672926212978106
1095590286.jpg,A yellow dog and a black and white dog are running in the dirt. A blond dog and a black and white dog run in a dirt field. Two dogs are running in a field. A dog chases another dog. Two dogs running around,7.757420039845189,7.966220200223927,7.887543995248619,7.418495924063018,3.5957901016304765
10956999.jpg,Two men barbecuing on the grill with a little girl playing in background. There are two people grilling food near a body of water. Two men stand behind a grill near the ocean. Two men barbecuing at a beach. Two men are grilling out.,7.03718523019858,7.153363866541375,7.043600647913091,6.914591176141273,3.741623211764703
10957138.jpg,"A girl in a floral bathing suit jumping on the beach in front of the waves. A little girl in a flower print bathing suit, jumping into the ocean. A girl in a swimsuit is jumping high, near water. A young girl is jumping in the air at the beach. A girl jumping into the ocean.",7.144105754730653,7.039270158001237,7.085099146885122,7.307947959305601,3.8592181620944572
1095980313.jpg,A little girl in a blue swimsuit is walking along a wooden fence next to a sandy beach. Little girl in blue swimsuit standing on a handrail near a beach. The little girl in the blue bathing suit is posing at the beach. A little girl with arms outstretched is posing at the beach. A young girl walks on a railing in front of the beach.,6.462543586054342,6.1925719879212195,7.298835911480668,5.896222858761139,3.8191744361642948
109608573.jpg,A man in a white shirt is outside leaning against a rail with hats hanging beside him. A man in a white t-shirt standing beside a rack of colorful hats. A young Asian boy sits on a railing behind a row of colorful hats A man is standing next to a rack with hats hanging on it. A young boy sits by an outdoor stand displaying hats.,7.861168659251866,7.87328289997007,7.820627021276135,7.889596056509391,3.797522563470962
1096097967.jpg,A black and white dog is being soaked with a jet of water in a blue paddling pool. A dog sticking its face into the shower from a garden hose. A black and white dog drinking water from a water spray. A white and black dog is jumping into a pool. A small white dog gets sprayed by water,7.8290566729530795,7.748161753508014,7.832292777931624,7.906715487419601,3.8989035396676655
1096165011.jpg,A smiling boy swims underwater in a pool. The boys smiles underwater at the pool. A redheaded boy swimming underwater. A small boy swimming underwater A boy smiles underwater. A Little boy in a red striped shirt on a blue couch pulling out all the pillows. A young boy is inside a couch cushion with stuffing hanging out. A little boy in a plaid shirt looks up as he lays on a blue sofa A young boy sucks on his arm while laying on a blue couch. A child is sitting on a couch with a ripped cushion. A young boy with his foot outstretched aims a toy at the camera in front of a fireplace. A little boy in orange shorts playing with a toy. A young child plays with his new light-up toy. Boy with toy gun pointed at the camera. A boy with a toy gun.,7.245082265799961,7.3144774166893525,7.255215104552889,7.165554276157638,3.8139045611116114
109656696.jpg,A girl in a polka dotted blue jean dress walks barefoot on a balance beam. A girl in a jean dress is walking along a raised balance beam. The little girl is walking a beam in gymnastics class. A little girl balances on a gymnastics beam. A little girl is walking on a balance beam.,7.655456073914956,7.6365386210745125,7.628333580069529,7.701496020600828,3.7104563592218454
109671650.jpg,A boy wearing blue and yellow walking on a cliff edge. A boy in yellow shorts is standing on top of a cliff. A young child is standing alone on some jagged rocks. A little boy standing high in the air on a rock. Child stands near edge of cliff.,6.830132155826309,7.296981342739856,7.390244072983775,5.803171051755297,3.786077887128562
1096800382.jpg,A man gestures while facing a woman wearing glasses as they sit inside a restaurant that includes a yellow wall. A man in a black shirt talking to a woman in a black shirt in a yellow room. Two people having a discussion sitting in a restaurant. A man and a woman are talking in a restaurant. A couple having a conversation over drinks.,7.196596555508525,7.259145249705991,7.404682008260456,6.925962408559128,3.7469524506128273
109738763.jpg,A snowmobile rider flies through the air on his or her machine in front of tall pine trees. Rider jumps snowmobile high in rural area. A person on a snowmobile in mid jump. A snowmobiler flies through the air. The man is up in the air.,6.746723896967737,6.653575485921566,7.125035331010396,6.461560873971248,3.7340380807043743
109738916.jpg,Two helmeted men sit on yellow snowmobiles while another man stands behind watching. People pose with helmets and goggles on while riding snowmobiles. Several people are taking a break while on a snowmobiling ride. People are riding around on snowmobiles. Three people and two snowmobiles.,7.580554669975996,7.646416728896781,7.613041370369569,7.482205910661639,3.825716863616985
109741554.jpg,"A man shovels snow off of a roof while another stands in the contraption that allowed them to reach the high place. Two men cleaning snow from a roof, one's in a lifter, while the other is actually on the roof. A man shoveling snow off the roof of a building. Two people working on removing snow from a roof. Two men work to shovel snow from rooftops.",7.012229775919554,7.070681201656297,7.045973771328761,6.920034354773604,3.762069039002115
1097463464.jpg,"A young boy wearing a black shirt, brown pants and a black watch has his hand on a white folded chair which is on the top of a large stack of similar folding chairs. A young man wearing a black shirt takes a folding chair from a large stack. A person helping to set up chairs for a big event. A young man in a black shirt stacks chairs. A boy is setting up folding chairs.",7.748491013997014,7.74655209117261,7.74719572175917,7.751725229059261,3.905908555162752
109770830.jpg,Two buildings beyond a concrete wall facing a walkway with a woman talking on a cellphone. A girl in a red winter coat walks down the city sidewalk as she speaks on the phone. Two modern buildings made of glass and stone accent the setting. A woman is walking at dusk down an urban street. Someone walking along a wall.,7.5258736429087065,7.534693302788375,7.507564395822174,7.5353632301155695,3.7806002108124774
1097710887.jpg,"A very young girl playing with a bubble-blowing wand, holding a bottle of bubble solution and walking through a park or field. A little girl with brown hair is blowing the petals off of a flower. A small girl in a dress blows bubbles in a grassy field. A little girl is blowing bubbles in a field. A little girl blowing bubbles.",7.849998612807833,7.9372383380834215,7.798899228127384,7.813858272212694,3.7385751652147916
109823394.jpg,Three people on ATVs in a brown field turn their heads to look at the camera. Three people ride their four wheelers through the field. Three people on four wheel ATV's in a field. Three people on ATV's outside. Three people drive ATVs.,7.673134027167808,7.804553380695727,7.704391950181988,7.510456750625707,3.6808483033046584
109823395.jpg,A person is riding an orange ATV in a large empty field. A man on a four wheeler is flying through the air. A four wheeler jumping in an empty field. Man jumping with all terrain vehicle Man on an ATV catching air!,6.943093607018518,7.100373671786777,7.007835554593314,6.721071594675465,3.8282607053383977
109823397.jpg,A person dressed in a tan jacket jumps a quad over a harvested cornfield in front of a small out building. An ATV is airborne over a field in front of a white structure. A man on a four-wheeler jumps near a small building. A man jumps gin the air while riding an ATV Man on four wheeler in the air.,7.268473740457534,7.444990948302029,7.28418141679023,7.076248856280342,3.8940078314150783
1099034049.jpg,"A girl is sitting on the beach and appears to be approaching a hit on the head by a plastic inflated hammer. A woman with dark hair wearing a bikini is sitting on a beach. A young woman, sitting in the sand, has her eyes closed. A woman on the beach getting hit with a blow up hammer. A woman sitting on the beach closes her eyes.",7.2197436094310605,7.009348650578984,7.166416587143245,7.483465590570955,3.783743310478775
1099434461.jpg,"A man is cooking a square pancake : he lifts it with his fingers and a spatula to check to see if it is done. There is a pancake pan cooking a pancake and a man is rolling it over on its opposite side with a spatula. A man's hand is shown helping a spatula to flip a pancake from a square frying pan in a messy kitchen. Two hands are flipping some food in a cast iron pan, with a spatula. A man makes a perfect, golden crepe.",7.599888877452899,7.58308364037696,7.632954064181744,7.583628927799992,3.8708310267155994
109982467.jpg,A mother and three children collecting garbage from a blue and white garbage can on the street. A woman and three children are picking something out of a blue trashcan. Three young children stand around a blue and white barrel. Four children are standing around a blue and white barrel. A group of children look into a barrel. A boy is jumping off the side of a running stone water fountain in front of a building. A boy in s striped shirt is jumping in front of a water fountain. A little boy is playfully jumping off the side of a fountain. A happy boy is jumping in front OD city fountain. A little boy is jumping in front of a fountain.,7.636460202425451,7.570991391093092,7.647565590315322,7.690823625867938,3.8662694268565736
1100708949.jpg,"Two women hugging in a grassy, fenced field with a cow's behind in the background. Two women are hugging on a path through a grassy area with a cow visible past them. Two sisters hugging while visiting a Farm and looking into the camera. Two girls are hugging in front of a tree and a hill. Two people hugging with cow in background at farm.",7.544542121956224,7.496989790764292,7.590575614115233,7.546060960989145,3.954272345560944
1101207553.jpg,There are two men in orange life vests signaling to a cruise ship docking at a pier. Two dock workers and small boat guiding a cruise ship to place to tie up on dock. Two men in orange and blue safety gear stand on the dock guiding a boat inward. A large ship approaching the dock with two men awaiting its arrival. Stevedores are waiting for a boat to dock.,7.622406582480352,7.657302687182563,7.551672735759471,7.6582443244990195,3.887949675704644
