image_filename,reference,image_entropy_total,image_entropy_r,image_entropy_g,image_entropy_b,text_entropy
111908743.jpg,A man in red pants balancing on a blue object with his hands A man wearing red pants is balancing on a blue sculpture. A man is raised up on his hands on a blue platform. A man in red pants jumping on a park table. An athlete leaping over an obstacle.,7.642195151175834,7.402540262404507,7.798088087632992,7.72595710349,3.758397272681069
1119418776.jpg,"A brown, black and white dog is running through a large field with its mouth open. A dog with its mouth open running through a field torwards the camera. A black, brown and white dog running through a field. A black and white dog is running through the field. A dog running in a field.",7.266235238112785,7.308397779858744,7.416564815789451,7.07374311869016,3.8596318863023087
1119463452.jpg,A little girl in a pink bathing suit swimming in a pool. Smiling little girl swimming in outdoor pool. A girl in a pink swimsuit in a pool A little girl swimming in a pool. A girl swimming in a pool.,7.590364784588066,7.528316149121949,7.610347784735857,7.6324304199063935,3.562674665291177
11205420.jpg,A man dressed in white walks a yellow rope on the ground that is attached to the handlebars of a bicycle. A man wearing all white is walking on a rope attached to a bike while surrounded by people. A bike sitting in a street with a rope tied to it and a guy walking on the rope. A street performer is performing with a bike in the foreground. A man is doing a trick with a bike.,7.610445458239613,7.603821644989901,7.6111119334668444,7.6164027962620935,3.8329679277949067
1121053156.jpg,A child and a young adult the adult is maybe demonstrating how to do something to teach the young child A man with a bucket and a child pointing to some machinery. A man and a child stand next to a blue and black tube. A man and child on a ship doing maintenance. A father and son working on a boat.,7.229043288096416,7.218220397181211,7.181978004486261,7.286931462621775,3.664557408318045
1121416483.jpg,A young girl does a handstand on a bed with blue sheets. A small child doing a handstand on a bed. A little girl standing on her head. A child is standing on her head. The girl is upside down on a bed,6.995784353727603,6.943514756617766,6.993866900180542,7.049971404384499,3.6364577442775143
11214205.jpg,Men with reflective safety jackets on are working on a street intersection with many orange reflective cones. Three construction workers in bright vests prepare road to be worked on. Men wearing orange safety vest are working on street repairs. A group of men in orange safety vests are working. Three construction men are working.,7.8032591974696475,7.864770957649512,7.806431935123047,7.738574699636386,3.81074536994578
11214370.jpg,A man in jeans and a yellow safety jacket is working on bricks in the ground. A man with a safety vest is kneeling down and cleaning the bricks. A man in a yellow vest and jeans is caulking a sidewalk. A man with a router working on the sidewalk. A man grinding stones with a tool.,7.877153655310835,7.910651059013572,7.906833431158489,7.813976475760445,3.831176635296169
11214470.jpg,Two men in construction vests are working on the side of a street with machines. Two construction workers are working on repairing a cobblestone walkway. Two construction workers operate a machine that steams the street. Workman are completing repairs on a city street. Two construction workers work on a road.,7.767373381254014,7.812670730965591,7.7802044119660465,7.709245000830405,3.750053001573277
112178718.jpg,Man is standing on white sand and holding a snowboard. A guy stands in the sand with a snowboard behind him. A man with his surfboard stands in the sand. A man holds his snowboard in the sand. A man holds a surfboard on the beach.,6.349679432490542,6.5638666129684395,6.230988917638928,6.254182766864258,3.6646371377200566
11220707.jpg,A construction worker standing on the roof of a house wearing an orange vest with a yellow hard hat. A construction worker is laboring on part of a house near a chain-link fence and trees. A man wearing a yellow hat and orange shirt with palm trees around. A man in an orange vest standing atop a building. A construction man looks over into the distance.,7.627718445601214,7.7233874323985905,7.7203194678354095,7.439448436569643,3.810666251847627
1122177096.jpg,A man wearing a yellow shirt and tan pants plays golf outside while being watched by other people. A guy in a yellow shirt and light brown slacks is playing golf while the crowd watch. Behind the fence spectators are looking at the golfer with the club in his hand. Tiger woods putts a golf ball toward a hole. Tiger woods about to make a putt,7.631348431275946,7.737749808806864,7.6261422861788315,7.530153198842141,3.8751641396549177
112220869.jpg,Blond girl in a yellow-belt martial arts uniform standing in front of a door and carrying a large trophy. A young girl smiles for the camera while holding a large trophy. A girl in a white outfit with a yellow belt is holding a trophy. A young girl in a karate uniform holding a large trophy. Little girl holding a karate trophy.,7.192581307839476,7.323466495612141,7.1647165125461,7.089560915360188,3.8558888549970582
1122357785.jpg,A young boy is falling into a pool of water with a man and a girl watching him. A man joyfully throws his son while swimming. Man and two children swimming in the lake. A kid with floaters jumping into a lake. A boy is jumping into a lake.,7.103797245367229,7.153010494499219,7.069605651725913,7.088775589876556,3.865772598632094
112243673.jpg,People on ATVs and dirt bikes are traveling along a worn path in a field surrounded by trees. Three people on two dirt-bikes and one four-wheeler are riding through brown grass. Three people ride off-road bikes through a field surrounded by trees. Three people on motorbikes follow a trail through dry grass. Three people are riding around on ATV's and motorcycles.,7.433288559038807,7.4756017182128325,7.4583941231928135,7.365869835710775,3.9753106810632213
112245524.jpg,A woman in a red tank top is cutting a hamburger in half with a spatula while opening or closing a drawer with the other hand. A woman wearing a red tank top is cutting a hamburger in half. A woman in red cuts a burger in half with a spatula. A young woman is fixing a hamburger in a kitchen. A woman in pink cuts a hamburger with a spatula.,7.7361556935803835,7.877619853163237,7.724355043099385,7.606492184478528,3.9049014559004656
1122579380.jpg,A woman wearing a long white t-shirt walking knee deep in the ocean. A boy in a dirty shirt is walking through knee-high ocean water. A boy in a white shirt walks in the ocean. A boy walking in the surf on a beach. A blond boy walking in the water.,7.159244643487386,7.17003811756883,7.113224864960131,7.194470947933196,3.822430326184623
112264837.jpg,A man in a suit reading a from a piece of paper in front of a nude sculpture. The man in the suit is standing near the naked sculpture. A man wearing a red tie standing in front of a statue. A man standing beside the back of a nude statue. A man is looking at a piece of paper.,7.336522386410871,7.41571049568039,7.430417552588301,7.163439110963923,3.6545924533531404
1122944218.jpg,A little toddler dressed in white is smiling while a lady helps him wave a flag. A baby in a white garment holds a flag with crescent moon and star. A baby is holding a small black flag with a moon and a star on it. Baby in white outfit holding black and white flag. A baby wearing a white gown waves a Muslim flag.,7.271219953966309,7.37808052270993,7.2336662233207765,7.2019131158682175,3.8387182515937694
1123486015.jpg,A man is standing on a small floating raft with a flag. A young man on a dock fishing near a flag from France. Man in white shirt staring out at the water. A person stands on a structure on the lake. A guy on a floating platform on the water.,7.674887552772261,7.779235004454053,7.7603742888642,7.485053364998528,3.6150987701631485
112411540.jpg,Young man wearing a wear jacket is behind a counter in a jewelry store gazing off into the distance. A young man in a gray jacket stands behind the counter of a jewelery store and smiles. A man in an olive colored coat is standing in a jewelry store. A pleasant young man working at a jewelry store. A man is standing behind a counter in a shop.,7.662046994647203,7.5802093108662945,7.711652411663208,7.694279261412108,3.8680504826039765
1124448967.jpg,"An older man sits back and relaxes on a patio outside an adobe building where many bicycles are propped. Topless old man wearing slippers, navy blue pants and a white hat while reclining in a chair outside. A shirtless man in a white cap relaxes in a deck chair, close to three parked bicycles. A half naked man is sleeping on his chair outdoors. Man relaxing in a folding chair on the street.",7.33641588602399,7.269198289140668,7.319148135302087,7.420901233629216,3.9252012053019323
11245644.jpg,"A newlywed couple is taking a picture outside on the steps of a building while other people are walking up and down the steps. Many people, including a couple in a wedding dress and suit, are walking or standing around a building with lots of stairs. People gathered at the steps of a church-like architecture. People walk up and down the steps in front of a church. People walking up and down the steps to a church.",7.838633110524506,7.904703903363364,7.920232155871042,7.690963272339111,3.933790442034712
112459543.jpg,A group of young children kick around a ball on a field with a body of water in the background. Group of children playing soccer with body of water in the background. Some children are playing football with a seacoast in the background. A number of children enjoy themselves on the coast of a city. Children are playing soccer on a rocky beach.,7.098920731611099,7.18744344100115,6.8992337029209425,7.210085050911208,4.010822227090081
112550433.jpg,"A woman in an orange top and black sweatpants jumps up with her arms out in front of the ocean on the beach. A woman in an orange shirt is taking part in physical activity on the beach. A woman dancing on the beach, with the ocean in the background. A female works out near the ocean side. A pretty girl dancing on a beach.",7.313072639743354,7.233721910552462,7.308100446970358,7.397395561707244,3.8206497085823043
112604461.jpg,Two men work together to attach pieces of wood in a room set up for carpentry. Two men are working on a wooden structure in their warehouse. Two men are working on a carpentry project with hand tools. Two men are working on putting together a wooden frame. Two men are building something out of wood.,7.825375325445973,7.786922515591476,7.8443026953277615,7.844900765418681,3.818169338830014
1126137905.jpg,"A group of people are standing outside at a carnival, near a ride called the Green Jungle. A crowd of people standing next to a shack labeled ""Green Jungle."" A group of people standing in front of a hut in a parking lot. Crowd standing near ""GREEN JUNGLE"" exhibit at festival. A group of people are gathered.",6.886101070719185,7.068187574822964,6.841208854681674,6.748906782652915,3.8499157735915452
1126403094.jpg,Two girls with purple hair and a short-haired woman are smiling. An older woman smiles on as two pink-haired women talk. A mother and her two daughters having a happy moment. The lady in the green shirt is laughing. A woman and two girls dressed in pink.,7.6754331708476355,7.732522090746988,7.678556783343553,7.615220638452365,3.788539901594933
1126450961.jpg,"A man in a business suit talking on the phone and carrying a briefcase walking by a mirrored building. A man in a black suit and briefcase hurrying somewhere, while talking on his cellphone. An asian man carrying a suitcase while talking on the phone and walking quickly. A man in a suit is walking and carrying a briefcase. A businessman in a suit is running.",7.569769545245428,7.477030918063205,7.559346400604707,7.6729313170683735,3.8054528888652586
112719695.jpg,"A woman in a pink shit and blue jeans is walking down a somewhat busy street while holding a cup of coffee. A brunette in jeans is walking down the street, holding a takeout cup of coffee. A trendy woman walks with her coffee past theaters at a large shopping complex. A brunette woman walking down a street with a cup. Lady walking down the street holding a cup.",7.5053436255989014,7.546959384398731,7.508433718908755,7.460637773489219,4.012347236924785
1128230658.jpg,A young boy with a shaved head and dirty white collared shirt holds a chicken in his arm. A bald little boy holds a chicken while two men are sitting in the background. A young boy with a shaved head holds a chicken under his left arm. A small child in poverty conditions is holding a chicken. A young bald boy holding a chicken.,7.495252641171572,7.484123216761528,7.4919852961217694,7.509649410631418,3.92317030984983
1128874064.jpg,A young girl sitting on a small chair surrounded by what looks like handmade fabrics and bags. A girl wearing a colorful hat sits on a woven mat. A young woman is making rugs in the rain forest A woman in a red hat sits on a rug. A woman sitting in a hut.,7.7354212143893895,7.746757536774048,7.709316640409875,7.7501894659842465,3.7211605051712984
112945950.jpg,"A couple sit on a ledge by the water, the woman leaning forward, the man looks out towards the water. A man and a woman are sitting down overlooking the water and the women is bending over. A man and a woman sitting on a sea wall looking out on the water. A man sitting on a wall and looking at a body of water. Couple sits next to a body of water under a clear sky.",6.626467499735125,6.779741649353333,6.652015023138839,6.447645826713202,3.7901231496361247
1129704496.jpg,A brown and white and a black and white dog hauling in a floating toy from the ocean. Two dogs run through the water with a rope in their mouths. Both dogs retrieve the play toy from the water. Two dogs tug at a chew toy in the surf. Two dogs in the ocean playing with a toy,7.438251958377834,7.558107823578199,7.430259810227887,7.326388241327417,3.7496666185458523
1130017585.jpg,"There are three young people, one dark-haired holding a bottled drink, one with head tilted back and finger in her mouth, and one with spiked hair. Three girls make faces as one takes a drink while they stand in a busy street. Three young women pose for the camera at a parade. Three women on the street drinking and posing The young people party in the streets.",7.775651394451039,7.909752660419839,7.778213280149995,7.638988242783283,3.8434392556769406
1130295306.jpg,"A boy in a striped blue shirt and gray pants, holding a blue scooter, is looking across a river. Several people walk along a waterway including a boy with a scooter. A boy wearing a rugby shirt standing next to a body of water. Boy in striped shirt looks at peaceful lake. A boy strolls by a pond in a park.",7.5762614693445975,7.618115293351828,7.694836292480125,7.415832822201838,3.8695937763479193
113032513.jpg,"Blond child with large black coat, multicolored scarf, and knit hat standing in front of a window. Little boy wearing a multicolored scarf and hat has a sad look on his face as he is looking down. A younger boy is wearing a striped scarf and stocking cap. A child standing outside in a matching cap and scarf. Young boy is dressed for cold weather.",7.444933105719996,7.484525898486276,7.355412468390792,7.49486095028292,3.9215055450423413
1130369873.jpg,"A brown dog swims through water outdoors with a tennis ball in its mouth. A red dog, holding a ball, splashes through vegetation filled water. A brown dog is running through neck-deep water carrying a tennis ball. A brown dog splashes in the water while carrying a ball in its mouth. Brown dog with tennis ball in mouth, in water and bushes.",7.403217489773502,7.488135200761325,7.401449074098612,7.320068194460569,3.9541870294950043
1130401779.jpg,Two brown dogs are creating large splashes as they run in a river. Two brown dogs runs through the water. Two brown dogs running through water. Two dogs splash through the water. Two brown dogs in the water.,7.6470965614401925,7.703641386730168,7.6612159314432455,7.576432366147163,3.6746018118726673
1131056918.jpg,Two young attractive women in front of a store drop coins for street performers. Two women enjoy the entertainment of street performers. Two men pretend to be statutes while women look on. Two young women stop and watch street performers. Pedestrians interact with street artists.,7.8265314470092235,7.8279638029671705,7.816113055420519,7.835517482639981,3.655141547488656
113109101.jpg,A red-haired little girl is blowing bubbles in the water of a pool. A young girl with red-hair blows bubbles in clear water. A girl blowing bubbles in the swimming pool. A little girl blowing bubbles in the water. A child blowing bubbles in water.,7.3939021391927495,7.424186270927743,7.239543047266108,7.517977099384394,3.8360826043709637
1131155939.jpg,"A black lav runs into the water on the beach, with swimmers in the distance and sea kelp in the foreground. A pile of seaweed sits on the sand, behind it a big black dog is running in the water. A dog at the shore of an ocean, with seaweed in foreground. A black dog runs into the ocean next to a pile of seaweed. A dog is running in the waves at the beach.",7.019214177152999,7.177790474310756,6.838726194890307,7.04112586225793,3.8504746867253608
1131340021.jpg,"The little boy, in a short-sleeved shirt and shorts, is running outside. The little boy is wearing a black pinstripe shirt and walking on a deck. Little boy in a striped shirt and brown shorts is running. Young boy running outside on the pavement. A young boy runs while wearing sandals.",7.621883849125614,7.682623228601636,7.558230074896261,7.624798243878946,3.8608170493387712
1131800850.jpg,A furry dog attempts to dry itself by shaking the water off its coat. A brown and white dog stands outside while it snows. The large brown and white dog shakes off water. A dog is looking at something near the water. A white and brown dog shaking its self dry. Two men with backpacks placed in front of them sitting in front of a railing. Two men are sitting on the ground and going through their backpacks. Two men with backpacks are sitting on cardboard along a railing. Two men sitting in front of a railing are looking at something. Two older men with backpacks sit at a bus station.,7.640107073317854,7.722777494023919,7.692295296612078,7.505248429317566,3.8573918822343907
1131883759.jpg,"Someone holding a piece of, what looks like clear plastic, down on a hard surface while they drill a hole through it. A small whole is being drilled into a white piece of plastic while being held down securely on a workbench. Someone working on a project using a jigsaw cutting machine. A hand holding an object while a hole is drilled in it. Someone is drilling some plastic on a wooden block.",7.572846030084989,7.531657385055196,7.536454459039349,7.650426246160423,3.892097992456043
1131889107.jpg,Roller derby girls waiting for the next round of action! A group of people getting ready to rollerskate A women's roller derby team taking a break. Women wearing rollerskates sit on the floor. Some rollerskaters are sitting down.,7.630626531795827,7.62970707927427,7.617444916136731,7.644727599976482,3.8493724211077445
1131932671.jpg,The boy in blue shorts is bouncing on the bed. A boy jumps from one bed to another. A boy jumped up from the green bed. A small child is jumping on a bed. A boy is jumping on a bed.,7.2466458587496385,7.200257132758473,7.280361883045612,7.259318560444832,3.718195828610404
1132772170.jpg,A man is standing with his arms folded looking at something while the person behind him is jumping onto one of the two beds in the room. A man wearing a yellow shirt standing in the middle of two beds that a boy is jumping on in the background A young child jumping on the bed as a man looks the other way. Man standing in the bedroom with little boy jumping into bed. A child leaping from bed to bed behind the back of a man.,7.234366922766182,7.604211770471058,7.329001568707627,6.76988742911986,3.933277626165717
113291048.jpg,A young man holds up a piece of wood and a chainsaw as presses a cigarette between his lips. A man carrying an electric saw and a square board inside of a shop. A boy in a gray hoodie holds up a chainsaw. A young man holding a huge chainsaw. A man holding a chainsaw.,7.742197423037144,7.720815737577368,7.7672539665145095,7.738522565019554,3.7247441617343
11337976.jpg,A shirtless man with sunglasses and a helmet is riding a motorcycle next to traffic cones. A man on a motorcycle without a shirt and another man standing under shade. A shadowy figure watches a shirtless man ride past on a chopper. A man on a motorcycle with no shirt on at a bike event. A shirtless man is riding a motorcycle.,6.8099895404020225,6.837187388158548,6.8507882714273345,6.741992961620187,3.843540027954586
11338041.jpg,"People waiting to enter a white building through an entry way with an orange handwritten sign to the left of it. Three people enter a building with a handwritten sign that says ""Welcome Bikers."" A line of people wait to enter a building with a sign posted ""Welcome Bikers."" A group of people enter a doorway next to a red sign reading ""WELCOME Bikers"". A group of people entering a building.",6.690937859288645,6.618273603003381,6.371787353041489,7.082752621821063,3.9197617328888392
113637264.jpg,A man in a white shirt lays cement on a brick wall. A bricklayer smoothing out concrete. A man is happily laying bricks. A man is putting up a wall. A man is mortaring bricks.,7.595098303338358,7.729902921705021,7.5978924186999635,7.457499569610091,3.6371546201985465
1136497229.jpg,A woman wearing glasses puts her hand on the shoulder of a young child as they sit at a flat wooden surface. A woman with glasses puts her arm around a very young child who is eating something. A woman has her arm around a child as the child is eating A brown-haired woman looks at a baby eating something. A woman touching her child's shoulder.,7.6656782842808395,7.594470298273719,7.663378365139044,7.739186189429754,3.9764617912385734
1136758631.jpg,"A woman in a black top with a shopping bag standing near the train tracks while others read. A line of people, some standing and some sitting, are waiting on a platform for a train. On a sunny day, a small crowd wait for the railroad on the platform. People, both standing and sitting, along a train track. Four people waiting at a train station on a sunny day.",7.848253386393048,7.8336539430043794,7.876777312556408,7.834328903618356,3.8326664701075375
113678030.jpg,"A snowboarder sits on a slope with skiers and boarders nearby. Snowboarders sitting in the snow while skiers take the hill. A snowboarder takes a rest on the mountainside. Two skiers stand, two sit on slopes. The snowboarder is sitting down.",7.0666212118413325,7.08439098431273,7.092627365259045,7.022845285952224,3.6861347076116653
113737410.jpg,Many people are walking around shopping in a brightly lit and colorful shopping mall. People strolling in a mall with colorful decorations hanging from the ceiling. People are walking around in a brightly-lit indoor shopping center. New mall has opened bringing a lot of shoppers. Many shoppers are walking around in a mall.,7.568630342281622,7.502436057532722,7.594055632916582,7.609399336395562,3.9624339940596274
11382381.jpg,A woman wearing a green tank top is working on a horse's shoe. A woman in a green tank top puts a horseshoe on a horse. A woman in a green shirt is working on a horse's hoof. A female blacksmith is shoeing a horse. A woman is shoeing a horse.,7.020284960783646,7.433587563227032,6.97938411855745,6.647883200566454,3.617387568830332
1138784872.jpg,A small child in green clothing walks past a store opening and a woman in pink pants. The child in the green one piece suit is walking past a store window. A young boy is walking in front of some stores A girl in green walks down a city street. A small child walks down a sidewalk.,7.13116825610807,7.109239902915561,7.128401622198356,7.155863243210293,3.761282185679803
1139029795.jpg,"A group of local cheerleaders in red and white kept our spirits up during the parade. A group of cheerleaders cheering on the street, dressed in red and white. Cheerleaders in red and white uniforms cheering in the street. Women are cheerleading in the street. A group of girls are cheering.",7.588616717062176,7.587386370424854,7.5592292316964995,7.6192345490651725,3.7335292255864787
11391827.jpg,"A man in a brown uniform reaching out from an industrial doorway, as if he is going to shut the door. A man is inside a truck looking out with his left arm in front of a door. A man in a brown shirt prepares to close the door. A delivery man exiting the back of a truck. A man opening a door and looking out.",6.918445180314754,6.9981973259188095,7.009822689655766,6.747315525369686,3.7916803432199275
114051287.jpg,A boy in a red soccer strip is holding his boots in his hand whilst stepping out of a car. A young boy gets out of the van and prepares his shoes for wear during a soccer game. A boy dressed in soccer attire and holding his shoes getting out of a car. A child getting out of the car wearing soccer shoes. A boy in glasses is wearing a red shirt.,7.511223624422001,7.703014103149064,7.554175756756752,7.27648101336019,3.811390841508904
